<?xml version="1.0" encoding="Windows-1252"?>
<xs:schema xmlns="http://www.uniovi.es"
 elementFormDefault="qualified"
 targetNamespace="http://www.uniovi.es" 
 xmlns:xs="http://www.w3.org/2001/XMLSchema">
	<xs:element name="rutas">
		<xs:complexType>
			<xs:sequence>
				<xs:element minOccurs="1" maxOccurs="unbounded" ref="ruta" />
			</xs:sequence>
		</xs:complexType>
	</xs:element>
	<xs:element name="ruta">
		<xs:complexType>
			<xs:sequence>
				<xs:element ref="descripcion" />
				<xs:element ref="coordenada" />
				<xs:element ref="referencias" />
				<xs:element ref="hitos" />
			</xs:sequence>
			<xs:attribute name="nombre" type="xs:string" use="required" />
			<xs:attribute name="tipo" type="xs:string" use="required" />
			<xs:attribute name="medio" type="xs:string" use="required" />
			<xs:attribute name="horaInicio" type="xs:time" use="optional" />
			<xs:attribute name="horaFin" type="xs:time"  use="optional"/>
			<xs:attribute name="duracion" type="xs:integer" use="required" />
			<xs:attribute name="agencia" type="xs:string" use="required" />
			<xs:attribute name="adecuadas" type="xs:string" use="required" />
			<xs:attribute name="lugarInicio" type="xs:string" use="required" />
			<xs:attribute name="dirInicio" type="xs:string" use="required" />
			<xs:attribute name="recomendacion" type="xs:integer" use="required" />
		</xs:complexType>
	</xs:element>
	<xs:element name="referencias">
		<xs:complexType>
			<xs:sequence>
				<xs:element minOccurs="3" maxOccurs="unbounded" ref="referencia" />
			</xs:sequence>
		</xs:complexType>
	</xs:element>
	<xs:element name="referencia">
		<xs:complexType>
			<xs:simpleContent>
				<xs:extension base="xs:string">
					<xs:attribute name="link" type="xs:string" use="required" />
				</xs:extension>
			</xs:simpleContent>
		</xs:complexType>
	</xs:element>
	<xs:element name="hitos">
		<xs:complexType>
			<xs:sequence>
				<xs:element minOccurs="3" maxOccurs="unbounded" ref="hito" />
			</xs:sequence>
		</xs:complexType>
	</xs:element>
	<xs:element name="hito">
		<xs:complexType>
			<xs:sequence>
				<xs:element ref="coordenada" />
				<xs:element ref="fotos" />
				<xs:element ref="videos" />
			</xs:sequence>
			<xs:attribute name="nombre" type="xs:string" use="required" />
			<xs:attribute name="descripcion" type="xs:string" use="required" />
			<xs:attribute name="distancia" type="xs:decimal" use="required" />
		</xs:complexType>
	</xs:element>
	<xs:element name="fotos">
		<xs:complexType>
			<xs:sequence>
				<xs:element minOccurs="1" maxOccurs="5" ref="foto" />
			</xs:sequence>
		</xs:complexType>
	</xs:element>
	<xs:element name="videos">
		<xs:complexType>
			<xs:sequence>
				<xs:element minOccurs="0" maxOccurs="3" ref="video" />
			</xs:sequence>
		</xs:complexType>
	</xs:element>
	<xs:element name="foto">
		<xs:complexType>
			<xs:simpleContent>
				<xs:extension base="xs:string">
					<xs:attribute name="link" type="xs:string" use="required" />
				</xs:extension>
			</xs:simpleContent>
		</xs:complexType>
	</xs:element>
	<xs:element name="video">
		<xs:complexType>
			<xs:simpleContent>
				<xs:extension base="xs:string">
					<xs:attribute name="link" type="xs:string" use="required" />
				</xs:extension>
			</xs:simpleContent>
		</xs:complexType>
	</xs:element>
	
	<xs:element name="coordenada">
		<xs:complexType>
			<xs:simpleContent>
				<xs:extension base="xs:string">
					<xs:attribute name="longitud" type="xs:decimal" use="required" />
					<xs:attribute name="latitud" type="xs:decimal" use="required" />
					<xs:attribute name="altura" type="xs:integer" use="required" />
				</xs:extension>
			</xs:simpleContent>
		</xs:complexType>
	</xs:element>
	<xs:element name="descripcion" type="xs:string" />
</xs:schema>